{"$id":"urn:lima:v4:lima.workflow-summary","$schema":"https://json-schema.org/draft/2020-12/schema","additionalProperties":false,"properties":{"evidence":{"items":{"properties":{"artifact_id":{"pattern":"^[A-Za-z0-9][A-Za-z0-9._:-]{0,127}$","type":"string"},"content_digest":{"pattern":"^[0-9a-f]{64}$","type":"string"},"kind":{"enum":["lima.repository-profile","lima.audit-evidence-package","lima.vulnerability-evidence-package","lima.repair-verification-report","lima.workflow","lima.stage-attempt","lima.security-outcome","lima.run-manifest"],"type":"string"},"schema_version":{"pattern":"^4\\.[0-9]+$","type":"string"}},"required":["kind","artifact_id","content_digest","schema_version"],"type":"object"},"maxItems":64,"type":"array"},"execution_status":{"enum":["succeeded","failed","cancelled"],"type":"string"},"legacy_artifact_ids":{"items":{"pattern":"^[A-Za-z0-9][A-Za-z0-9._:-]{0,127}$","type":"string"},"maxItems":256,"type":"array"},"run_manifest":{"oneOf":[{"properties":{"artifact_id":{"pattern":"^[A-Za-z0-9][A-Za-z0-9._:-]{0,127}$","type":"string"},"content_digest":{"pattern":"^[0-9a-f]{64}$","type":"string"},"kind":{"enum":["lima.repository-profile","lima.audit-evidence-package","lima.vulnerability-evidence-package","lima.repair-verification-report","lima.workflow","lima.stage-attempt","lima.security-outcome","lima.run-manifest"],"type":"string"},"schema_version":{"pattern":"^4\\.[0-9]+$","type":"string"}},"required":["kind","artifact_id","content_digest","schema_version"],"type":"object"},{"type":"null"}]},"security_outcome":{"oneOf":[{"properties":{"artifact_id":{"pattern":"^[A-Za-z0-9][A-Za-z0-9._:-]{0,127}$","type":"string"},"content_digest":{"pattern":"^[0-9a-f]{64}$","type":"string"},"kind":{"enum":["lima.repository-profile","lima.audit-evidence-package","lima.vulnerability-evidence-package","lima.repair-verification-report","lima.workflow","lima.stage-attempt","lima.security-outcome","lima.run-manifest"],"type":"string"},"schema_version":{"pattern":"^4\\.[0-9]+$","type":"string"}},"required":["kind","artifact_id","content_digest","schema_version"],"type":"object"},{"type":"null"}]},"source":{"enum":["chain","legacy_audit"],"type":"string"},"stage_attempts":{"items":{"properties":{"artifact_id":{"pattern":"^[A-Za-z0-9][A-Za-z0-9._:-]{0,127}$","type":"string"},"content_digest":{"pattern":"^[0-9a-f]{64}$","type":"string"},"kind":{"enum":["lima.repository-profile","lima.audit-evidence-package","lima.vulnerability-evidence-package","lima.repair-verification-report","lima.workflow","lima.stage-attempt","lima.security-outcome","lima.run-manifest"],"type":"string"},"schema_version":{"pattern":"^4\\.[0-9]+$","type":"string"}},"required":["kind","artifact_id","content_digest","schema_version"],"type":"object"},"maxItems":256,"type":"array"},"workflow":{"oneOf":[{"properties":{"artifact_id":{"pattern":"^[A-Za-z0-9][A-Za-z0-9._:-]{0,127}$","type":"string"},"content_digest":{"pattern":"^[0-9a-f]{64}$","type":"string"},"kind":{"enum":["lima.repository-profile","lima.audit-evidence-package","lima.vulnerability-evidence-package","lima.repair-verification-report","lima.workflow","lima.stage-attempt","lima.security-outcome","lima.run-manifest"],"type":"string"},"schema_version":{"pattern":"^4\\.[0-9]+$","type":"string"}},"required":["kind","artifact_id","content_digest","schema_version"],"type":"object"},{"type":"null"}]}},"required":["evidence","execution_status","legacy_artifact_ids","run_manifest","security_outcome","source","stage_attempts","workflow"],"title":"lima.workflow-summary","type":"object"}