{"evidence":[{"artifact_id":"rvr-0001","content_digest":"a9a35d358308a2957b9182d2ca5e503903d8c7282c6c43bb09d1680313cb2cac","kind":"lima.repair-verification-report","schema_version":"4.0"},{"artifact_id":"vep-0001","content_digest":"cd76622b48d11c0300e63d7489701479c75dc2f4b06cc6c4e88af1f453061d01","kind":"lima.vulnerability-evidence-package","schema_version":"4.0"}],"execution_status":"succeeded","legacy_artifact_ids":[],"run_manifest":{"artifact_id":"run-0001","content_digest":"213fbebd48a966ee9071b5a19f385731e833b17f4d8c7c653c55b2c19eaf9cd7","kind":"lima.run-manifest","schema_version":"4.0"},"security_outcome":{"artifact_id":"sec-0001","content_digest":"bfa0b2dc55940bcdadf88f8e4991adb4d762f7a8b17ded3fa8817936504ba831","kind":"lima.security-outcome","schema_version":"4.0"},"source":"chain","stage_attempts":[{"artifact_id":"attempt-audit-0001","content_digest":"418c461a1d82fcc9cbf6b60d1caad21e76491abe2d4f4a0a3a1a178cb15e8fb4","kind":"lima.stage-attempt","schema_version":"4.0"},{"artifact_id":"attempt-profile-0001","content_digest":"34746de4860ae5ce9ec69c43ad8c8ad596d4e79172a284bf3defc1a866edb259","kind":"lima.stage-attempt","schema_version":"4.0"}],"workflow":{"artifact_id":"wf-0001","content_digest":"3be59c6c7f1736954fbce5f1e74b4c7789ab8a1e956f4229904ea30bbe756146","kind":"lima.workflow","schema_version":"4.0"}}